text,label,original_label
"After Hurricane Katrina, Dallas and San Antonio took in 5,000 to 10,000 refugees each, but (Bill) White brought in 250,000 and put them up in his buddies empty apartment buildings and let the federal government pay their rents for over two years. They did not return to New Orleans, most of them are on welfare.",1,0
Says Ron Johnson referred to The Lego Movie as an insidious anti-business conspiracy.,0,1
Says salaries and benefits for Wisconsin state employee comprised 8.5 percent of the 2009-2011 state budget.,1,0
Mary Burke wasted 12.5 million dollars on a vacant lot in a move that could cost taxpayers nearly $25 million.,1,0
More private-sector jobs were created in the second year of the Obama administration than in the eight years of the Bush administration.,0,1
A gun background check is futile. Something like 42 (people during the) last year were prosecuted for trying to buy a gun with a criminal record out of 11 million.,0,1
"""If you read the Arizona (immigration) law, what it says is if you are stopped for violating the law and they have a suspicion that you're illegal, they can ask you if you're legal.""",0,1
"Today in America, 70 percent of us are earning the same or less than we were 12 years ago, and this is the first time that that has happened this side of World War II.",0,1
Says Chuck Hagel opposed sanctions against Iran.,0,1
Seventy percent of the people in the state of New Jersey want marriage equality.,1,0
"In Massachusetts, Gov. Romney narrowed the gap between students of different races.",0,1
An average of seven children in America are killed by guns every day.,0,1
Volunteer firefighters and communities they serve in Georgia and elsewhere are being devastated by Obamacare.,0,1
Says HillaryClintons immigration platform would create totally open borders.,1,0
Only four countries in the world allow abortions after 20 weeks of pregnancy.,0,1
Says Paul Ryan backs a proposal that would be a bailout of Puerto Rico.,0,1
Obamacare has caused millions of full-time jobs to become part-time.,0,1
"In the period from 2007 to 2011, the Office of Health Insurance Commissioner reported an 18 percent decline in the states total medical spending.",0,1
"Says if Congress doesnt avoid the sequester, tens of thousands of parents will have to scramble to find child care for their kids.",0,1
Obama used to be a lawyer for ACORN.,0,1
"Citing his efforts to secure the border, Obama said, Overall, the number of people trying to cross our border illegally is the lowest it has been since the 1970s.",0,1
State legislators quietly shifted $2 billion from education to road building in 2013.,1,0
Says Connie Mack voted to redefine rape as forcible rape.,0,1
"Says Catherine Cortez Masto indicted (Brian Krolicki), who was an innocent man, in order to save Harry Reids political career",0,1
"In May we generated more jobs than all the rest of the country combined: 28,000 jobs in May for the state, 54,000 for the entire country.",0,1
Says the national health care law puts federal bureaucrats between an American citizen and her doctor.,1,0
Report: 3 million votes in presidential election cast by illegal aliens.,1,0
On whether humans contribute to global warming,0,1
The stories from women saying he groped or forced himself on them largely have been debunked.,1,0
Democrats give Newports to the homeless to get them to the polls.,0,1
"Says Sen. Mark Begich is ineffective because he has only passed one bill, the naming of a building.",0,1
The decision to cancel the trademark of the Washington Redskins is not the Patent and Trademark Office. This is Barack Obama.,1,0
We have tougher standards holding toy gun manufacturers and sellers to account than we do for real guns.,0,1
"In the last decade, the average income of the bottom 90 percent of all working Americans actually declined. The top 1 percent saw their income rise by an average of more than a quarter of a million dollars each.",0,1
"""He's a good man but he's a pro-life liberal. He's right on the pro-life part, but he's a liberal.""",0,1
Says the U.S. national debt has tripled during Rep. Greg Waldens time in Congress.,0,1
"We should be seeing numbers in the 500,000 jobs created per month. (Creating 115,000 jobs, the total from April 2012) is way, way, way off from what should happen in a normal recovery.",0,1
"Our county now has the fastest growing airport in America, attracting nearly 1,000 new private sector jobs.",0,1
Coca-Colas CEO said he finds it easier to do work in China than in the United States.,0,1
"Under the Iran nuclear deal, we give them $150 billion, we get nothing.",1,0
"Research shows the employer mandate in the House health reform bill would ""place millions 'at substantial risk of unemployment' with minority workers losing their jobs at twice the rate of their white counterparts.""",0,1
"""I have never asked for nor received a single earmark or pork barrel project for my state.""",1,0
"The Democratic leader in the Senate, Harry Reid, has blocked any vote on the Keystone pipeline for years.",0,1
Says Hillary Clinton wants to bring in thousands of refugees to America from all around the world without any kind of security screening.,1,0
"After initially agreeing with Republicans on an amount for Zika funding, Democrats derailed it.",0,1
Says you cannot implement Paul Ryans plan without allowing for any increases in revenue.,0,1
I recently had the opportunity to vote to give the president limited authority to begin strikes against terrorists in Iraq and Syria.,1,0
"In the last two years, I have supported and proposed $155 billion worth of targeting cuts. Dr. Gingrey has presented zero.",0,1
Ben Franklin once quipped that only two things in life were certain: death and taxes. I think even he didnt envision that the tax man would visit on the day of your death.,1,0
Federal government reneging on Medicaid payments to Wisconsin caused about $240 million in extra costs in the 2013-15 state budget.,1,0
Says Rick Perry cut taxes.,0,1
We are living with a legacy of deficit-spending that began almost a decade ago.,0,1
The presidents first major foreign policy speech in Cairo was to apologize for our country.,1,0
The Milwaukee Bucks are actually younger than the Marquette team.,1,0
Says Connie Mack failed to pay his child support.,1,0
Says David Jolly lobbied on a plan by Rep. Paul Ryan that would turn Medicare into a voucher program.,0,1
Says Donald Trump doesnt believe in equal pay.,0,1
St. Pete Beachs experiences are a fair example of what could happen if Amendment 4 passes.,0,1
Paul Ryan is one of only six House Republicans who voted for Teddy Kennedys bill to force Christian employers to hire LGBT employees.,1,0
"""The vast majority of the money I got was from small donors all across the country.''",1,0
The median income in America has dropped by 10 percent in the last four years.,0,1
Says Rick Scott cut Medicaid so people cant get Obamacare.,0,1
"The stimulus bill includes ""$8 billion for high-speed rail projects, such as a 'magnetic levitation' line from Las Vegas to Disneyland.""",0,1
"Since Debbie Halvorson has been in politics, Illinois has lost hundreds of thousands of jobs.",0,1
SaysJosh Mandels campaign is under FBI investigation,1,0
I have tremendous support from women.,1,0
Says theres not much evidence to suggest that people have (contributed to global warming) or can do very much to change anything.,1,0
"Obama said he would ""stand with the Muslims should the political winds shift in an ugly direction.""",1,0
"Says I worked with our Mayor and other commissioners to help save the school year when a budget crisis in Salem threatened to cut four weeks of the school year, including negotiating with teachers to work for free.",1,0
Sarah Eckhardt refused to take her own pay increases repeatedly.,0,1
This is the year Florida becomes a majority minority state.,1,0
Says Greg Abbott converted over $1 million in federal grant money intended for use to prosecute online sexual predators and other cyber crimes and instead used it to harass and prosecute senior citizens who were assisting other senior citizens in applying for mail-in ballots.,1,0
"In Texas, sexting is a felony sex offense for teenagers that can mean up to 10 years in prison.",0,1
"In Muslim countries, under the Sharia, there is a death penalty for blaspheming Mohammad.",0,1
[A]n extra 8 million Americans [are] projected to join state Medicaid programs in the next few years.,0,1
Martin Luther King was a Republican.,1,0
"Ohio has created 45,000 new manufacturing jobs since 2010. And thats due in large part to the fact that the auto rescue has helped Ohio.",0,1
"""West has raised $2 million from those that would leave our beaches in ruins, end Social Security and Medicare, and give corporations free reign.""",1,0
Portland Bureau of Transportation barely break(s) even ticketing motorists.,0,1
Ben Unger supported a 15 percent property tax increase on Oregon seniors.,0,1
Fewer than 10 percent of those in the House are what anyone would classify as wealthy.,1,0
"In Ohio, more than half the providers of safe and legal abortion have had to shut down since Gov. John Kasich took office in 2011.",0,1
"Says neither President Barack Obama nor Mexico President Felipe Calderon have been on the border to see whats happening to the citizens of Mexico, and for that matter the citizens of Texas.",0,1
Says our national debt is greater than our gross domestic product.,0,1
"""First, he said he would take all of our troops out in six months, and now he acknowledges it would take a year.""",0,1
The incandescent light bulb has no effect whatever on the planet.,1,0
"The president's plan, even after the end of its withdrawal timeline is reached, will leave in place up to 50,000 U.S. troops.",1,0
Says Donald Trump was a Democrat longer in the last decade than he was a Republican.,0,1
"Says that when adjusted for inflation and population growth, state general revenue spending has decreased 10.7 percent on his watch.",0,1
"Republicans would give seniors a (Medicare) voucher that limits whats covered, costing seniors as much as $6,400 more a year.",0,1
"For people in the top 1 percent for income, your effective tax burden is in the low 20s, the lowest its been in decades and decades and decades -- lower than somebody who might make substantially less money.",0,1
"Bill Nelson voted for a ban on millions of commonly owned firearms, which included many popular hunting and target rifles.",1,0
"More lives have been lost because of the war with the drug cartels in Juarez alone, just a few blocks from the United States of America, than have been lost in the war in Afghanistan.",1,0
"A gas tax holiday is a gimmick that ""every economist says will just go into the pockets of the oil companies.""",0,1
"""Marco Rubio thinks that government shouldn't be in the health care business at all.""",1,0
"Says that Mitt Romneys response to the crisis in the auto industry was, Let Detroit go bankrupt.",0,1
Multnomah County has faced 11 straight years of cuts,0,1
On sequestration,1,0
I have now put out all of my emails.,0,1
"Says President Barack Obama neversaid, No boots on the ground in Syria.",1,0
Wisconsins Supreme Court justices are deciding fewer opinions in civil and criminal cases than they used to.,1,0
Says President Obamas grandmother in Kenya said he was born in Kenya and she was there and witnessed the birth.,1,0
We have more people working in the state of New Jersey today than weve ever had in our history.,1,0
"Says the federal government is spending $765,828 to subsidize pancakes for yuppies in Washington.",0,1
The Republican Party has the worst reputation in American polling of any political party in history.,0,1
Nevada is still a state that is 80 percent white voters.,1,0
There are currently delays of up to six months in the processing of DNA evidence at the state run crime lab.,0,1
"Says an estimate that Texas will face an $18 billion budget gap is a number that somebody just reached up in the air and grabbed.""",1,0
On whether he would run for U.S. Senate in 2012.,1,0
Says opposing the Paycheck Fairness Act is part of the Koch brothers agenda.,0,1
"This past (legislative) session, we passed out of the Legislature a resolution requiring Congress to pass a balanced-budget amendment to the (U.S.) Constitution.",0,1
"Thirty-seven percent of Central Falls retired police officers and firefighters are out on disability pensions; in most municipalities, about 5 percent of retirees collect disability pensions.",1,0
Theres a 1.5 percent to 2 percent overhead in Medicare. The insurance companies have a 20 percent to 30 percent overhead.,0,1
"Josh Mandel used to be pro-choice, now hes anti-choice. He used to be sympathetic towards gay and lesbians and now hes [not].",0,1
Theres still about $400 billion or $500 billion of the stimulus plan that has not been spent. Why dont we stop it.,1,0
"For years now, we have spent more money than we have taken in.",0,1
Says David Dewhurst went out for drinks during Senate debate on abortion bill.,0,1
"The CDC issued a report commissioned by President Obama just earlier this year, and it found some very inconvenient facts. Armed citizens are less likely harmed by attackers. Effectiveness of gun control laws is mixed. Gun buybacks dont work.",0,1
"Says Rand Paul thinks drug-dealing, theft, burglary and prostitution should be decriminalized.",1,0
"By the time you drink your coffee, an elephant is killed for its ivory tusks.",0,1
The overwhelming amount of the money that were raisingis not going to Hillary (Clinton) to run for president. ...Its going to the congressmen and senators to try to take back Congress.,0,1
"When Sarah Palin was in government, Barack Obama was a community organizer.",1,0
Says his 9-9-9 tax reform plan is not regressive.,1,0
About half the people who would qualify for Medicaid expansion in Florida can buy a health care plan for $30 a month on the federal health care exchange.,0,1
"Insurers delayed an Illinois man's treatment, and he died because of it.",1,0
Fox changed around their poll eligibility criteria on the day they announced who is in and out of their debate.,0,1
"""Both China and Japan have surpassed us, with Japanese cars now getting an average of 45 miles to the gallon.""",0,1
"Since President Obama took office, our federal spending has increased by nearly 30 percent and our national debt has increased by almost 50 percent.",0,1
"Since President Obama took full control of Washington, every day, 13,000 more people have been put on food stamps.",0,1
The election bill allows persons to correct an absentee ballot if they did not sign it and requires an extra two hours a day for early voting. Everything else in this bill is discretionary.,0,1
President Barack Obama deserves to be called the most successful food stamp president in American history because 47 million Americans are on food stamps.,0,1
Under the Obama plan . . . all the health care in this country is eventually going to be run by the government.,1,0
"Ryan Sittons company accepted over $650,000 in Obama stimulus dollars.",1,0
"A former Clinton administration official and other economists agree that if you keep extending these temporary unemployment benefits, youre just going to extend joblessness even more.",0,1
"In the past decade, K-12 funding has grown six times faster than the rate of enrollment.",0,1
"Will (HB2)threaten federal funding for public schools under Title IX? No, according to a federal court which has looked at a similar issue.",0,1
"Some of the things that (Megyn Kelly) said, I didnt say.",1,0
The total (state) payroll has gone down. The total amount of the number of workers in the state has gone down. I like the fact that the bulk of that is just by retirements.,0,1
We can fix our roads without raising taxes.,1,0
Obama couldn't have afforded his home without Rezko's help.,1,0
Americas least-trusted news sources are also its most popular.,0,1
"Among the nations 51 largest metropolitan areas, Milwaukee is the only one where the poverty rate is more than four times greater in the city than it is in the suburbs.",0,1
"Obama's first call (as president) to any head of state was to Mahmoud Abbas, leader of Fatah party in the Palestinian territory.",0,1
"""The Clintons now charge the Secret Service $10,000 monthly rent for the use of (a) Secret Service residence and that rent is just about equal to their mortgage payment.""",1,0
Says an appointed board created under Obamacare will have the ability to come between you and your doctor in determining the best treatment options for you!,1,0
David Cicilline is the 5th most liberal person in the House of Representatives.,1,0
The Obama administration raised discretionary spending by 24 percent from President George W. Bushs last full-year budget and will run up more debt by October than Bush did in eight years.,0,1
"200,000 students attempt suicide every year on college campuses.",0,1
Newt balanced the federal budget.,0,1
The cost of fire in Rhode Island is anywhere from 33 percent to 100 percent more expensive than anywhere else we could find.,0,1
"Says his administration put more border patrol agents on the U.S.-Mexico border than at any time in history, and the flow of undocumented workers across the border is actually lower than its been in 40 years.",0,1
"In an interview with the Chicago TribunesEditorial Board, Comptroller Leslie Munger says that in order to balance a budget, the state would have to cut social services completely.",1,0
Says U.S. Rep. Tammy Baldwin is backing President Barack Obamas plan to pass a $1.5 trillion tax increase.,1,0
"When Mitt Romney was governor, the fact is that the average income for a family in Massachusetts went up by $5,500.",0,1
Twenty million Americans are out of work.,0,1
"A proposed revenue smart cap gives Floridians a voice, requiring a 60 percent vote by citizens in order to impose a new tax, fee, license, fine, charge or assessment.",1,0
The U.S. Postal Service doesnt run on your tax dollars. Its funded solely by stamps and postage.,0,1
Cheney is disagreeing with President Bush's policy. President Bush stated repeatedly to international audiences and to the country that he wanted to close Guantanamo.,0,1
"""Barack Obama's nominee for 'regulatory czar' has advocated a 'Fairness Doctrine' for the Internet"" that would require links to opposing opinions.",0,1
There is no reason to allocate 60 percent of bridge space to satisfy two percent of all travelers.,0,1
"If 20 million illegals vote, you can kiss the Second Amendment goodbye.",1,0
Planned Parenthood has now (been) found to also illegally sell baby parts.,1,0
Perry pushed for a law that lets insurance companies raise homeowners rates without having to justify the increase.,1,0
"As a congressman, Mark Neumann voted four times to increase our debt.",0,1
"If parents ""don't have health insurance that Senator Obama wants them to have (for their children), they will be fined.""",0,1
Says sixty-two percent of small businesses over the last five years went under because they couldnt pay their health care bills.,1,0
Jesus was an undocumented immigrant.,1,0
On gay marriage,1,0
"Ann Kuster supports the government takeover of healthcare, which robs Medicare of over $700 billion.",1,0
"While Rob Portman relies on his super PAC and a handful of billionaires to do his dirty work, we dont have a super PAC, and quite frankly, we dont want one that spends millions to spew out lies and distortions.",0,1
Its four or five states where the number of insurance options have narrowed under the Affordable Care Act.,1,0
Says opponents of proposed Austin school district bonds say the districts debt load doubles with these new bonds.,0,1
Says U.S. House candidate Carlos Curbelo supported ending the Medicare guarantee.,1,0
"The Obama administration ""was successful in rushing a massive spending bill through Congress in just two days after which it sat on the president's desk for three days, while he was away on vacation.""",1,0
"In 1992, Barack Obama directed ""Project Vote - an arm of ACORN that also encouraged voter registration.""",1,0
"In this country, we have a 25 percent dropout rate.",0,1
"Every 20 seconds, a child dies because they lack access to clean water and sanitation.",0,1
"Right now, our corrections department charges taxpayers between $30,000 and $40,000 a year per person we lock up, she said. Thats actually cheap when you compare us to the rest of the country.",0,1
"Portland, Ore., has never gotten over 12 to 15 percent ridership of its public transit system in the past 12 years.",0,1
Solar and wind energy are both cheaper than nuclear right now.,0,1
Says New Jersey has the highest unemployment rate in the region and stagnant job growth.,0,1
"None of the polls being conducted right now have us on the top line. None of them. Its always Trump and Clinton and then second question, third question. ... If we were included in the top line, as Johnson/Trump/Clinton, wed be at 20 percent.",1,0
Sen. Barbara Boxer passed only three bills in 18 years into law.,1,0
"Since the passage of the Affordable Care Act, U.S. health care spending grew at 3.9 percent for the last three years, the lowest growth rate in over 50 years.",0,1
Sanctuary cities such as Philadelphia refuse to cooperate with the federal government in locating suspected terrorists who are in their custody and are in the country illegally.,0,1
"Under President Barack Obama, 8.3 (million) fewer Americans are working today than there were four years ago.",1,0
"Teenage births cost Texas taxpayers $1.1 billion in health care, foster careand lost tax revenue in 2010 alone.",0,1
Says she made an accurate prediction that if Barack Obama were elected it would encourage Russia to invade Ukraine.,0,1
"Says Donald Trump, in his campaign announcement speech, also said, And many of them (Mexicans) are good people. You keep leaving that out of your quote.",0,1
Republican Bob Donovan has run as a Republican time and again.,0,1
Hedge fund managers and others in private equity pay much lower (tax) rates on their income than do truck drivers and teachers and nurses.,1,0
It still had not gotten terrible on the roads by 2 to 3 p.m. Tuesday.,1,0
"Due to over-incarceration in 1950, two out of three young black men were in the workforce. Today, its one out of three black men are in the workforce.",0,1
"I am the only person in this field who is against amnesty. Every other person in this field wants to allow people who are here illegally to be able to stay here, in one form or another.",1,0
Says Gov. Rick Scotts approval ratings are up.,1,0
Says all my grandparents immigrated to America.,1,0
Mickey Mouse was registered to vote (in Florida).,1,0
"Since February 2009, our economy has lost roughly 3 million private sector jobs while the federal government has grown by more than 400,000 jobs.",0,1
State Medicaid expansion will save our treasury $1 billion over the next eight years.,0,1
"Under Scott Walker, the Wisconsin middle class is shrinking at a faster rate than any other state in the country.",1,0
"What we have done with the PATRIOT Act, weve given the government enormous powers. Weve given the government the right to reach deeply into peoples private lives, into their business affairs, without a court order.",0,1
The economic impact of Atlantas 2000 Super Bowl was $292 million.,1,0
Do you know those former Soviet Bloc countries have all moved to flat taxes?,0,1
Georgia legislation on immigration is a copycat of an Arizona immigration bill.,0,1
One of the other inaccuracies ...is that we have raised taxes multiple times and run up the budget. Absolutely not true. One tax increase since Ive been in office. It was a quarter mill tax in the unincorporated area only.,1,0
"The profit [from automated traffic enforcement cameras] is going to the private corporations, not to the city or state.",1,0
Were broke. We dont have any more money.,1,0
When I was U.S. Attorney we wound up putting 10 percent of the state Legislature in jail during my seven years.,1,0
David Dewhurst has never once cut one penny from the state budget.,1,0
Its illegal for a state to say were simply going to cut off (union contract) negotiations. Theres a legal requirement that you are involved in good faith bargaining.,0,1
"Women still do not get paid as much as men, even for the same work, period.",0,1
Says Donald Trump has a long history of exporting jobs overseas.,0,1
"Scott Walker to cut $300 million from universities, spend $500 million on a pro basketball stadium.",0,1
A defense bill includes language that would require military hospitals to provide abortions on demand.,1,0
Says Gov. Scott Walkers repeal of a 2009 law has left Wisconsin as one of five states without an equal pay law protecting women from gender discrimination in their paycheck.,1,0
We are the only major country on Earth that doesnt guarantee health care to all people as a right.,0,1
Theres a mosque inside of the Pentagon.,1,0
"""If we went back to the obesity rates that existed back in the 1980s, the Medicare system over several years could save as much as a trillion dollars.""",1,0
"Domestic violence is seen as a pre-existing health condition and women had to pay 50 percent more for health care because of gender ratings, but under Obamacare, all of that is over.",0,1
Says Austin is the largest city in the U.S. without nonstop flights to Europe.,1,0
On Common Core education standards,0,1
"Says (t)his 12 year council Seat-warmer has never chaired, vice chaired, or led a single Council committee meeting.",1,0
On running for the U.S. Senate as an independent.,0,1
Says the Beaumont school districts superintendent is the highest-paid in the state.,0,1
