text,label,original_label
Says the Annies List political group supports third-trimester abortions on demand.,1,0
When did the decline of coal start? It started when natural gas took off that started to begin in (President George W.) Bushs administration.,0,1
Health care reform legislation is likely to mandate free sex change surgeries.,1,0
The economic turnaround started at the end of my term.,0,1
"""I'm the only person on this stage who has worked actively just last year passing, along with Russ Feingold, some of the toughest ethics reform since Watergate.""",0,1
"However, it took $19.5 million in Oregon Lottery funds for the Port of Newport to eventually land the new NOAA Marine Operations Center-Pacific.",0,1
"Since 2000, nearly 12 million Americans have slipped out of the middle class and into poverty.",0,1
"When Mitt Romney was governor of Massachusetts, we didnt just slow the rate of growth of our government, we actually cut it.",1,0
"In this last election in November, ... 63 percent of the American people chose not to vote, ... 80 percent of young people, (and) 75 percent of low-income workers chose not to vote.",0,1
"Water rates in Manila, Philippines, were raised up to 845 percent when a subsidiary of the World Bank became a partial owner.",0,1
Women and men both are making less when you adjust for inflation than when John Kitzhaber was first elected governor.,1,0
"Says Scott Walker favors cutting up to 350,000 families and children off health care.",0,1
I dont know who (Jonathan Gruber) is.,1,0
Rick Perry has never lost an election and remains the only person to have won the Texas governorship three times in landslide elections.,0,1
"ISIS supporter tweeted at 10:34 a.m. Shooting began at 10:45 a.m. in Chattanooga, Tenn.",1,0
What (the Obama administration is) going to come out with in the next several months is youre not even going to be able to burn coal very limitedly in the existing plants.,1,0
Says a U.S. Supreme Court justice suggested that some U.S. cases will be decided based on South African law.,1,0
Says Marco Rubio skipped 18 defense votes including one to arm the Kurds to fight ISIS.,0,1
"""We have a director of homeland security who cannot use and will not use the term 'terrorist attack' but instead substitutes 'man-made disaster.' """,1,0
African-American youth unemployment is 51 percent. Hispanic youth unemployment is 36 percent.,0,1
President Barack Obama took exactly none of his own deficit reduction commissions ideas. Not one.,1,0
Says Terry McAuliffe is the person who invented the scheme to rent out the Lincoln Bedroom.,1,0
"In Georgia, women earn 82 cents for every dollar earned by men.",0,1
A federal system that verifies employees are authorized to work in the U.S. is inaccurate anywhere from 50 percent all the way up to in excess of 80 percent of the time.,0,1
"""Sen. Obama's campaign announced that he's choosing his cabinet.""",1,0
Only 2 percent of public high schools in the country offer PE classes.,1,0
"Under Mayor Cicilline, [Providence] was a sanctuary city.",1,0
"Says the man who rushed the stage at him in Dayton, Ohio, had chatter about ISIS, or with ISIS in his social media posts.",1,0
On whether a U.S. Supreme Court nominee should be forthcoming at confirmation hearings.,1,0
Says Charlie Crist supports cuts to the Medicare Advantage program.,1,0
I think it is unacceptable for the Chinese today to be larger in wind power and in solar panels and photovoltaic manufacturing than all of Europe put together -- forget the United States.,0,1
"At some point in their lives, 99% of women use birth control.",0,1
"In the past 20 years, Egypt has made great strides in political and democratic reform.",1,0
The amount of attention paid this week to Chris Christie makes the coverage of Benghazi ... pale in significance.,1,0
"In Rick Perrys Texas, we import nurses ... from other countries.",0,1
Austin is burdened by the fastest-growing tax increases of any major city in the nation.,1,0
"Phoenix, Arizona, is the No. 2 kidnapping capital of the world.",1,0
Says a poll found him the only Republican candidate who could beat Barack Obama in Texas -- and by eight points.,0,1
The Florida Department of Agricultures website FreshFromFlorida.com can be used to get a permit to carry a loaded hidden gun without ever leaving your house.,1,0
"NATO is opening up a major terror division. ... Im sure Im not going to get credit for it, but that was largely because of what I was saying and my criticism of NATO.",1,0
"Since Gina Raimondo took office, investment fees on the states pension portfolio have gone up from about $12 million annually to about $50 million.",0,1
"Under President Barack Obamas jobs bill, states would no longer have to lay off teachers, firefighters and police officers.",0,1
"Of our 98,000 teachers who are K-12, over 53,000 of those teachers today are over 50 years old.",1,0
"Under President Obamas health-care reforms, the premium for an average plan for a family didnt go down by $2,500 per year, its gone up about $2,500 per year.",0,1
"The IRS also investigated liberal groups, groups that had progressive in their name. ... The IRS was basically looking at everybody.",0,1
"About half of the presidents have been governors; half of them, senators.",1,0
The Air Force wants taxpayers to fund a fantasy football league.,1,0
About 3 percent of murders and crimes are committed with guns from people who actually (legally) purchase those guns.,0,1
SaysMichael Bennet wants to close Guantanamo Bay prisonand bring terrorists right here to Colorado.,1,0
Mr. Caprio is a career politician who has never worked in the private sector.,1,0
Donald Trump has said nuclear proliferation is OK.,0,1
Barack Obama has never even worked in business.,1,0
Says the Arizona immigration law expressly bans racial profiling.,0,1
Says Gov. Rick Perry has been begging for the federal government to send the Coast Guard to patrol two lakes on the U.S.-Mexico border.,1,0
"In 2005, Dan Branch tried to expand third-trimester abortions in Texas.",1,0
We (Democrats) have made steady progress creating jobs and improving our schools.,0,1
Im the only one whos fought against developers draining the Everglades!,1,0
Says Ron Johnson calls Social Security a Ponzi scheme and wants to privatize the program.,0,1
"There are 31 other states and 10,000 other cities that have the same type of policies that we just passed, referring to North Carolinas House Bill 2.",0,1
"""While Sarah was Mayor of Wasilla she tried to fire our highly respected City Librarian because the Librarian refused to consider removing from the library some books that Sarah wanted removed.""",0,1
"If Milwaukee approves reducing its maximum forfeiture for marijuana possession to $50, the city would have 23 different bicycle violations that have a higher forfeiture.",0,1
We have more illegal immigrants here than we did five years ago.,1,0
The U.S. Patent and Trademark Office received zero complaints about the Washington Redskins name.,1,0
Says Chris Christie vetoed a jobs package of 30 bills.,0,1
Says Illinois gubernatorial candidate Bill Bradys first priority after winning the primary was to sponsor a bill that would mass-euthanize sheltered dogs and cats in gas chambers.,0,1
Barack Obama is in an economy thats only worsened since hes been president of the United States.,0,1
"Says New Jersey is down nearly 200,000 jobs from its pre-recession peak and with Gov. Chris Christie New Jersey has trailed the rest of America when it comes to unemployment for 12 consecutive months.",0,1
Says Thomas Eric Duncan came into the United States with an elevated temperature.,1,0
Gas prices have gone up $2 since Obama took office.,0,1
"Seniors with coverage under Medicare Advantage will give up ""more than their share"" because of health care reform",0,1
"Over 12,000 school kids were arrested in Florida. It makes Florida the nations leader in that area.",0,1
There are more oil rigs in operation in the United States than the rest of the world combined.,1,0
"Payday lenders profit from the poor by charging 1,000-plus percent interest.",0,1
"The Social Security trust fund is sound. Without anything being done, it would function well into 2038; and even after that time with no changes, we could pay 80 percent of the benefits that people have earned.",0,1
The Obama administration shut down the Amber Alert program because of the government shutdown.,1,0
"Every single one of the 41 Republican senators who just blocked a raise in the minimum wage will receive a $2,800 cost-of-living adjustment on January 1, 2015.",0,1
"Under the Cash for Clunkers program, all we've got to do is ... go to a local junkyard, all you've got to do is tow it to your house. And you're going to get $4,500.",1,0
Not one Republican has the guts to recognize that climate change is real.,1,0
"While our people work longer hours for lower wages, almost all new income goes to the top 1 percent.",0,1
"In the last five years, 28,000 people have been killed along the U.S.-Mexico border.",1,0
Says Obama health reform law denies millions access to affordable insurance.,1,0
Close to 30% of our federal prison population consists of illegal immigrants.,1,0
Says Rick Scott called education not a core function of the state.,1,0
"The Family Research Council, according to some government agencies, is a terrorist group.",1,0
Obamacare is the biggest tax increase in American history.,1,0
Josh Mandel is lying about his own record. The rating of Ohios investment fund has NOT improved.,1,0
"Rick Scott took $200,000 from a family that leased land for drilling and now he is trying to hide from it.",0,1
On how money from a possible lease of the Ohio Turnpike would be used,0,1
"The president has had 1,540 of his nominations confirmed, only four defeated.",0,1
"""One percent of the American people make over 21 percent of all the income in America. That wasnt the way before George Bush became president.""",0,1
"Military ""recruiting went on at Harvard every single day throughout the time (Kagan) was there.""",0,1
"Says David Perdue wants to abolish the U.S. Department of Education, which would cost Georgia schools $1 billion a year and eliminate millions in student loans.",0,1
The United States imprisons more than any nation in the world.,0,1
Providences port is 200 miles closer to Europe than any other Eastern port.,1,0
"""Hillary Clinton supported NAFTA and permanent China trade. Pennsylvania lost thousands of jobs.""",0,1
Numerous studies have shown that these so-called right-to-work laws do not generate jobs and economic growth.,0,1
We now have driven (health care) costs down to the lowest theyve been in 50 years.,1,0
"President Barack Obama's ""initial response when we heard about the Christmas underwear bomber"" was to say that ""this was the act of an isolated extremist.""",0,1
"Says Sen. Sherrod Brown admitted that his $787 billion stimulus law failed and after specifically attacking Republicans for wanting to lower Americans taxes, (he) now claims that his stimulus bill didnt do enough to lower taxes.",0,1
Twelve judges have thrown out legal challenges to the health care law because they rejected the notion that the health care law was unconstitutional.,1,0
Says Gov. Chris Christies proposal to reduce state income taxes would be the second tax cut for the rich by the governor in two years.,0,1
A precinct in the Allen West-Patrick Murphy recount has 7 registered voters in Guatemalan community and the tally showed 900 voted!!!!!,1,0
Local law enforcement . . . will have access to the [Obamacare] Data Hubs treasure trove of personal info.,1,0
"Terry McAuliffe wants to raise your taxes $1,700 to pay for his infinite promises.",1,0
"Hypocrisy at the Clinton Foundation: Top male staff made on average $218,029 while top female staff made $153,014 from 2010-2014.",0,1
Says federal law enforcement officers cut off questioning of the Christmas Day underwear bomber by giving him a Miranda warning after 30 minutes of questioning.,0,1
On legalizing illegal immigrants.,0,1
"We are ""borrowing Saudi money for Saudi oil"" with the result being ""dependency and debt.""",0,1
"Says there are homes for sale on and around (Oswego Lake) right now for under $150,000 that anyone is welcome to buy.",0,1
"Since the president became the president, we have lost 3.3 million jobs in the private sector. But you know whos done OK and whos not complaining today? The public sector. Weve gained 590,000 public sector jobs.",0,1
The top 1 percent pay over half of the entire revenue for this country.,1,0
Chris Christie has not increased the taxes on anyone.,0,1
Says he never said he would keep education funding the same.,1,0
"Says Sen. Rob Portman said, It would be irresponsible not to cut Medicare.",0,1
"""(Palin) supported right-wing extremist Pat Buchanan for president in 2000.""",1,0
"Washington, D.C., had some of the strictest gun laws in the country. And when they passed them, violence skyrocketed.",0,1
"While fighting a move to toughen penalties for workplace gender discrimination, state Sen. Glenn Grothman said he didnt believe women belonged in the workplace but belonged at home, cooking and cleaning and having babies.",1,0
"If you put the $47 billion in revenue (raised over 10 years by the Buffett rule) into infrastructure you could create 611,000 infrastructure jobs.",1,0
On using the Strategic Petroleum Reserve.,1,0
Upwards of 90 percent of women seeking an abortion decide not to have an abortion after seeing an ultrasound.,1,0
"Says Scott Walker wants to ban common forms of birth control, including the pill.",0,1
Jason Kander supports [Obamas] plan to bring the remaining suspected terrorists to U.S. soil.,1,0
"Shelby County donated Im sorry, gave 44 schools to the city of Memphis.",0,1
"Top U.S. intelligence officials have toldevery member of Congress, including the president, were about to be attacked in a serious way because (of) the threat emanating from Syria and Iraq.",0,1
"""There are mechanisms in place to shut down the Internet privately.""",0,1
Report that #GOP insisting on changes to Social Security as part of #fiscalcliff false. BTW those changes are supported by @barackobama.,0,1
"Rep. Paul Ryans Medicare plan lines the pockets of the private insurance companies, increases costs for seniors and does not reduce the deficit.",0,1
74 percent of Republicans support the Affordable Care Act.,1,0
"For every $1 spent on afterschool programs, we can save over $5, almost $6, in crime costs down the line.",0,1
"The federal government has $3 trillion in cash flow, so we can pay our bills and wont default.",0,1
Says Alex Sink failed Florida homeowners by using predatory lending practices.,1,0
"Hillary Clinton supports unlimited abortion on demand up until the moment of birth, including partial-birth abortion, with taxpayer funding.",1,0
The STAR Ohio fund just received the highest possible credit rating one of these funds can receive.,0,1
"Taxpayers are on the hook ... for less than a third of the proposed new Atlanta Falcons stadium, and those funds are repaid from money that comes from outsiders.",0,1
"Every year, more than $40 million are leaving Missouri for the Lone Star State.",0,1
Recent international reports show the United States near the bottom among industrialized nations for k-12 academic achievement.,0,1
"The policy mistakes that ... the Clintons made got us, in large degree, to the situation that we are in today with mass incarceration.",0,1
They tried to give us $400 million to build a high-speed train that goes 39 miles an hour.,0,1
"Says the CBO estimates that fully extending the Bush tax cuts would add 600,000-1.4 million jobs in 2011 and 900,000-2.7 million jobs in 2012.",0,1
"According to David Cay Johnston, the average American pays about 22 percent of their income to federal taxes. The richest 400 Americans pay about 16 percent of their income to federal taxes.",0,1
"Most young Americans right now, theyre not covered by health insurance.",1,0
"Last week the Texas State Board of Education (SBOE), led by Rick Perrys appointee, voted to remove Thomas Jefferson from social studies textbook standards. Thats right. Thomas Jefferson... was deleted from a list of historical figures who inspired political change.",0,1
"From 2013-2015, the richest 14 Americans increased their net wealth by more than $157 billion, yet the Republican budget would not require these Americans to contribute one penny to deficit reduction.",0,1
"Says that while Foster was mayor, Rick Kriseman was ineffective in the Florida House of Representatives because there was no legislation that passed the House that had (Krisemans) name on it.",0,1
Cell phone numbers go public this month.,1,0
Clackamas County Commissioners approved a re-negotiated agreement to lower the countys contribution to TriMets Portland-Milwaukie Light Rail project to $19.9 million from $25 million.,1,0
The Obama administration is unwinding our nations welfare-to-work requirements.,1,0
The Redskins Training Camp deal generated $40 million in new private investment in the city.,0,1
The GOP budget plan would cut nearly a million jobs.,0,1
There are more people living in this country who were not born here than at anytime in the history of the country.,0,1
Says Hillary Clinton defended Syrias President Assad as a possible reformer at the start of that countrys civil war.,0,1
"The Postal Services financial losses result from a 2006 law that drains $5 billion a year from post office revenue, while the Postal Service is forced to overpay billions more into federal accounts.",0,1
"If black America were a country, itd be the 15th wealthiest nation in the world.",1,0
"Since Republicans took over after the 2010 election, the graduation rate in Wisconsin has gone from 86 percent to 88 percent. The black graduation rate has gone from 60 percent to 65 percent. The Latino graduation rate has gone from 65 percent to 71 percent.",0,1
"Since Rick Perry became governor, Texas has gone from 46th in the country to 50th in the population that graduates from high school.",0,1
The streetcar project planned by Mayor Tom Barrett would be a 1900s style trolley.,0,1
"Americans, in the last 30 years, have more than doubled the amount of money we are spending per child (on education) and the results have gotten worse, not better.",0,1
Says Congressman Bill Pascrell voted to remove the public option from the Affordable Health Care Act.,1,0
"Enacting the Right-to-Carry Act would amount to expanding the rights of sex offenders, terrorists, child predators, and abusers to carry concealed weapons across state lines.",0,1
Jorge Elorza wants to impose a municipal income tax.,1,0
"Nathan Deal cut the HOPE scholarship program so that literally 100,000 Georgians will not be able to go to college or get technical training that they so badly needed to raise -- you know, give them a chance at a good job.",0,1
"""As governor of Arkansas, I cut taxes and fees almost 100 times, saving the taxpayers almost $380-million. I left a surplus of nearly $850-million.""",0,1
I havent raised taxes in the time Ive been the governor of New Jersey.,0,1
Massachusetts public schools teach kids as young as kindergartners about gay marriage.,1,0
Six people in Florida die as a result of (not expanding Medicaid) every day.,0,1
SaysRand Paulhas put out budgets to cut the military in half.,1,0
Groups that receive foreign money are spending huge sums to influence American elections.,0,1
"[A]t his current rate, President Obama will have added more debt to the United State of America by the end of his first term than each of the previous 43 presidents -- combined!",0,1
We know that Saudi Arabia started al-Qaida.,0,1
"The fundraising numbers are in, and our grassroots support is unmatched!",1,0
"""Democrats are kind of falling over each other seeing who can raise taxes faster. It looks like they're going to raise taxes anywhere between 20 to 30 percent.""",0,1
"Says he passed eight measures, including ones to prevent groping at airport security checks and to bar sanctuary cities in Texas.",0,1
Its gotten to a point where the average federal worker makes twice as much as the average private sector worker.,1,0
These 15 political appointees (on the IPAB) will make all the major health care decisions for over 300 million Americans.,1,0
"Dan Patrick said that if women get paid less than a man for the same job, that thats not a problem.",0,1
"Weve got an average of 5,600 soldiers committing suicide. Thats about 20 a day.",0,1
"ISIS camp a few miles from Texas, Mexican authorities confirm.",1,0
New federal projections estimate that the health care overhaul will cost $1.76 trillion over 10 years -- well above the $940 billion Democrats originally claimed.,1,0
Social Security is indeed a Ponzi scheme.,1,0
The omnibus bill has only $3.8 billion in earmarks.,1,0
"Kim Myers voted repeatedly to raise taxes on the people of Broome County, but made millions off of tax savings when her family business relocated its headquarters.",0,1
"Californias Prop 60, which would requirecondom usein adult films, would put workers in the adult film industry at riskfor lawsuits and harassment.",0,1
"Sens. Isaksons, Chambliss Votes Against Unemployment Insurance Were Votes to Kill Nearly 6,000 Georgia Jobs.",0,1
Says today unemployment has been running near 12 percent or more for the last four years and the Legislature hasnt done much to lower it.,0,1
Says Kay Bailey Hutchison voted for sanctuary cities.,1,0
John Mica voted to borrow $10 trillion.,0,1
"When terrorists killed more than 250 Americans in Lebanon under Ronald Reagan, the Democrats didnt make that a partisan issue.",0,1
"""John wasn't this raging populist four years ago"" when he ran for president.",1,0
Says no one from the Bush family attended the 2012 Republican National Convention and there was no President Bush at the 2008 convention.,1,0
"(Texas Republicans) believe in abolishing Social Security, abolishing V.A. health care.",1,0
The bulk of the people who are shot with a weapon other than these drug gangs taking on one another end up being shot with their own weapon.,0,1
"In the case of General Motors, the (Bush) administration wrote a check without asking for any conditions of change.",1,0
Salaries for URI faculty are second to last among New England land grant universities and in lowest 20 percent of major U.S. research institutions,0,1
"When President, then candidate, Obama was asked to disclose some of his donors because there was suspicion of their being the foreign source of money into his campaign, they refused to do it.",1,0
Oregon is the only state out of the 50 states in the USA that continues to pay 100% of the medical benefits for its employees and their families.,1,0
You wonder why you dont see Rand Paul as much; hes still shopping for his billionaire. Hes like the only one who hasnt found a billionaire to fund his super PAC.,1,0
"Says Donald Trump cashed in on Sept. 11,collecting $150,000 in federal funds intended to help small businesses recover even though days after the attack Trump said his properties were not affected.",0,1
The Mitchell Park Domes lose about $1 million-plus every year and the number of people going to the Domes has been going down.,1,0
"Under a bill before the legislature, youd have to go to court to fire an employee.",1,0
"Under the Hate Crimes bill, ""any pastor, preacher, priest, rabbi or imam who gives a sermon out of their moral traditions about sexual practices could be found guilty of a federal crime.""",1,0
George Allen and his colleagues in the Senate turned the biggest surplus in the history of the United States into the biggest deficit in the history of the United States.,0,1
Says President Obama has cracked down on employers who are attracting undocumented immigrants and hiring them more than any previous president.,0,1
"""I told the Congress 'thanks, but no thanks,' on that Bridge to Nowhere.""",0,1
Unemployment has fallen from 10 percent during the presidents first year in office to 8.5 percent today.,0,1
"American voters remain steadfast in their support for immigration reform with a path to citizenship, with more than 70 percent who want to see reform passed this year.",0,1
There were more people on welfare than working in 2013.,1,0
Atlanta is the No. 1 trading point for sexual slavery in America. Between 100 and 200 girls are sold into slavery in Atlanta every month.,0,1
"According to a national survey, transit ridership among people age 16 to 34 increased 40 percent between 2001 and 2009.",0,1
Any legislative action that is taken now could very well be rendered completely null and void by the decision of the Supreme Court expected this June.,1,0
Im the only (Republican)candidate that has actually reduced the size of government.,0,1
"After how hard you work and how much you pay in taxes, New York City ends up getting the money. Im Chris Jacobs. I think its time we have someone in Albany thats making sure our region gets our fair share",1,0
This administration and this Congress have been systematically cutting funding to border security since the Democrats took control.,1,0
Says Cory Booker supports late-term and partial-birth abortion and opposes safety regulations.,0,1
Mitt Romney is the first major party candidate for president of the United States in modern times not to release at least 12 years of tax returns.,1,0
"In the month of July alone, EU exports to South Korea increased by over 36 percent. A lot of that is our market share. Those are our farmers and our service providers who are suffering.",0,1
"As Virginia lost over 65,000 jobs, (Tim) Kaine put partisan ambitions first by serving as DNC chairman during the last year of his governorship.",0,1
