text,label,original_label
"As a result of the House Republican bill, the nonpartisan Congressional Budget Office now confirms that families will see their health care premiums reduced by up to 10 percent.",0,1
Says Thomas Jefferson helped craft the Constitution.,1,0
Florida has the most errors and exonerations from death row.,0,1
A recent economic uptick appears to coincide with the expectation of a new Republican Congress.,1,0
"""There is no precedent for what the Democrats are doing with this deception. ... We have never written a reconciliation bill to amend a law that does not exist.""",0,1
"I was one of the few, very few, who voted `no on the Iran deal.",1,0
On expanding Medicaid under the Affordable Care Act.,1,0
The House Zika bill limits access to birth control services needed to help curb the spread of the virus in Puerto Rico.,0,1
Says the claim that 40 percent of guns are sold without background checks traces to information gathered before background checks were even required.,0,1
"Doctors kill about 250,000 people a year in botched surgeries.",1,0
The White House branded the memorial service for the Tucson shootings with a Together We Thrive logo and slogan.,1,0
"Obama ""changed the rules in Washington. Gone are the free gifts from lobbyists. Gone are the fancy airplane rides for nothing.""",0,1
"""President Eisenhower, on the night before the Normandy invasion...[wrote a] letter of resignation to the United States Army for the failure of the landings at Normandy.""",1,0
"Barack Obama has ""reversed"" on his commitment ""to begin withdrawing American troops from Iraq immediately.""",1,0
"Between 2008 and 2014, criminal aliens accounted for 38 percentof all murder convictions in the five states of California, Texas, Arizona, Florida and New York.",1,0
Repealing Obamacare saves our nation more than $2 trillion.,1,0
"Statistics show that more people at this time telecommute than they ride carpools, mass transit, bicycle or walk.",0,1
"""We have constitutional amendment that says that there's a ban on drilling right off Florida's coast.""",1,0
Oregon is the most trade-dependent state in the nation,1,0
"Says Hillary Clinton is proposing to print instant work permits for millions of illegal immigrants to come in and take everybodys jobs, including low-income African-Americans.",1,0
"One of the interesting things about the Recovery Act was most of the projects came in under budget, faster than expected, because theres just not a lot of work there.",0,1
Says Austin has the lowest property tax rate by far of the five major cities in Texas.,0,1
I didnt support Sonia Sotomayor.,1,0
Says Chris Christie was the first governor in America to endorse Mitt Romney.,1,0
"General Electric hasnt really created any jobs in this country, doesnt pay any taxes, and theyre making historic profits.",0,1
Iowas Republican caucus stopped mattering years ago. It in no way determines the party nominee.,0,1
Texans eat more catfish than residents of all other states combined.,1,0
Says Ted Cruz wanted to let in more Syrian refugees and give amnesty to illegal immigrants.,0,1
"[W]hen adjusted for cost of living, Georgia ranks first nationally in teacher salary and benefits.",0,1
About 3 percent of Gov. Nathan Deals appointments have been African-American.,0,1
"More lives are lost from violence against women, sex-selective abortion, female infanticide, suicide, egregious maternal mortality, and other sex-linked causes than were lost during all of the wars and civil strife of the 20th century.",0,1
The benefits that were offered to me as a congressman dont even compare to the benefits that you get as a state employee. I just experienced that myself. Theyre not nearly as good.,0,1
Huckabee supported a tuition break to the children of illegals that are here illegally when citizens are having to pay a higher rate.,0,1
"Obama ""voted for and even sponsored amendments that were intended to kill the (immigration overhaul) legislation.""",0,1
Weve seen highway fatalities actually decrease in Colorado since marijuana use was legalized.,0,1
"""I believe, Senator Clinton, you've raised more money from those people (the oil and gas industry) than any candidate, Democrat or Republican.""",0,1
Gov. Rick Scott is trying to get a waiver under the federal health care law that would deny consumers in Florida the right to the $60 million in rebates they have from their own HMOs.,0,1
The current (agriculture) commissioner allowed tainted beef to be sent to school cafeterias.,1,0
Says the states budget shortfall is not that much different than it was in 2003.,1,0
"Sen. Joe Biden, the ranking member of the Foreign Relations Committee, recommended partitioning Iraq into three separate entities.",0,1
The overwhelming number of school districts reported their staff stayed the same or grew after the 2011-13 state budget,1,0
"""My plan offers three times as much tax relief to the middle class as Senator McCain's.""",0,1
"Thirty million Americans, including a lot of people in Florida, are going to be able to get healthcare next year because of that law.",1,0
Says under U.S. Sen. Robert Menendezs watch the nations unemployment rate and debt doubled and the federal budget deficit quadrupled.,0,1
Theres only one candidate under investigation -- Terry McAuliffe.,1,0
"The percent of students who enter high school and eventually earn a diploma or equivalent, or who remain in pursuit of a diploma or equivalent, is 90 percent.",0,1
"We have been focusing so much, especially the Texas Department of Transportation, on that 97 percent of people in single-occupancy vehicles.",1,0
"When those restrictions expire (in the Iran nuclear deal), Iran will have an industrial-size military nuclear capability ready to go.",1,0
There are millions of women all across the country who rely on Planned Parenthood for not just contraceptive care; they rely on it for mammograms.,0,1
"Under Obama's tax plan, ""95 percent of you will get a tax cut.""",0,1
It is simply a fact that insufficient funding for Amtrak has delayed the installation of a positive train control safety system. To deny a connection between the (derailment in Philadelphia) and underfunding Amtrak is to deny reality.,0,1
Says the acting chief of the IRS said he and the majority of IRS employees would rather stay with his current health plan than switch to Obamacare.,0,1
President Barack Obamas budget threatens national security by proposing an Army of fewer personnel than we had before Pearl Harbor.,1,0
"Says that under his tax plan, no matter where you are in the stratosphere, youre going to be getting a tax cut.",1,0
Says she voted for a statewide fracking ban.,0,1
"Says Texas has been waiting for two years for the federal government to act on a proposal to allow the state to ""create insurance opportunities for those that are uninsured today.""",1,0
Says he was endorsed by theValley News newspaper.,1,0
"We had a massive landslide victory, as you know, in the Electoral College.",1,0
More people have been put on food stamps by Barack Obama than any president in American history.,0,1
A new bill was written into the new health care reform initiative ensuring that Congress will be 100 percent exempt.,1,0
"If Rhode Island raises the meal and beverage tax to 10 percent, it would be the fourth-highest in the nation.",0,1
Says the Austin chapter of the League of Women Voters has no Republicans among elected officers or on its debate committee.,0,1
"Says that according to a report, the tech sector now drives more than one-quarter of Austins economy.",0,1
"The form students fill out to get college financial aid is ""longer than the form to get U.S. citizenship.""",1,0
Says Hillary Clinton has been given tens of millions of dollars by countries that treat women horribly ...and countries that kill gays.,0,1
"In Texas, a faceless hospital panel can deny life-sustaining care, giving you only 10 days to find another facility for your mother, dad, or young child, even if the patient is conscious.",0,1
On repeal and replace of federal health care reform.,1,0
Under the Obama economy ... utility bills are higher.,0,1
Our real unemployment is anywhere from 18 to 20 percent. Dont believe the 5.6. Dont believe it.,1,0
House Republicans just passed a bill that makes it legal for single mothers to be fired by their employers.,1,0
This president has offered fewer executive actions than almost any other president preceding his presidency in recent history.,0,1
People are five to seven times more likely to be murdered in workplaces that allow firearms than in those that prohibit it.,0,1
"Under Floridas voting law, a requirement to turn in voter registrations within 48 hours makes it impossible to meet the deadline if youre working right to the end of the week.",1,0
There are a multitude of vaccines that do not prevent deadly and crippling diseases.,1,0
China holds 26 percent of the U.S. debt.,1,0
A National Football League lockout would cost Atlanta $160 million in lost jobs and revenue.,1,0
President Obama has spent over $2 million in legal fees defending lawsuits about his birth certificate.,1,0
"Repealing the sales tax on boats in Rhode Island has spawned 2,000 companies, 7,000 jobs and close to $2 billion a year in sales activity.",0,1
Says Newt Gingrich supports amnesty for illegal immigrants.,0,1
"""There's no rationing in any of these bills.""",1,0
A bill backed by Sean Duffy and other House Republicans could actually require the Internal Revenue Service to conduct audits of rape victims who get an abortion.,1,0
Obamacare puts the federal government between you and your doctor.,1,0
Saturdays shootings reflect a disturbing trend. Mass shootings have become commonplace since the Virginia Tech massacre in 2007. There have been dozens of incidents where three or more people have been fatally wounded. Hundreds have died.,0,1
Says tax revenues are the lowest they have been since World War II.,0,1
Says Barack Obamas health care law will be the biggest job-killer ever.,1,0
Secretary Geithner has left the option on the table of abandoning the dollar for a multinational currency.,1,0
"Says Scott Walker cut funding to local governments in Wisconsin, contributing to the second-largest increase in violent crime in the Midwest.",0,1
Says U.S. Rep. Martin Heinrich spent a trillion of our tax dollars on a stimulus for failed companies here and jobs overseas.,1,0
FCAT tests account for less than 1 percent of the instructional time provided during the year.,1,0
The health care bill has six years of costs against 10 years of tax revenue.,0,1
Says Sen. John McCain has taken more money from Wall Street than any other sitting senator.,0,1
"Just two weeks ago, Congressman Hurd quit his post on the House Committee on Small Business saying that he was unable to find the time to serve.",0,1
"Says that since lawmakers acted, we have 130 new businesses across Texas doing helicopter hog hunts.",1,0
"Cass Sunstein, President Obama's nominee for regulatory czar, ""wants to give legal standing to animals so they can sue you for eating meat.""",0,1
"Gas prices have doubled because Obama opposed exploring for energy in Alaska. He gave millions of tax dollars to Solyndra, which then went bankrupt. And he blocked the Keystone pipeline. So we will all pay more at the pump.",1,0
"Says Lee Leffingwell has been mayor of Austin, Texas for about as long as Sarah Palin was governor of Alaska.",1,0
"Because of President Barack Obamas failure to push job creation, the black unemployment rate in Ferguson, Mo., is three times higher than the white unemployment rate.",1,0
"70 percent of the people who voted on June 5, 2012, just didnt feel comfortable with the recall of the governor, weakening any idea that Wisconsin is fully behind this Walker agenda.",0,1
"134,000 (criminal) aliens have been released by the (Obama) administration in just the past two years.",0,1
Says the National Labor Relations Board told Boeing that it couldnt build a factory in South Carolina because South Carolina is a right-to-work state.,1,0
"The Trump Winery near Charlottesville, Va. is the largest winery on the East Coast.",1,0
I have the No. 1 show on NBC.,0,1
Thirty-five states have accepted high-speed intercity rail money.,0,1
Says Hillary Clinton completely ignored dozens and dozens of requests for more security for the Benghazi consulate.,0,1
There is no evidence to support the claim that Guantanamo is used as a recruiting tool for terrorists.,0,1
On supporting the budget proposed by Rep. Paul Ryan,1,0
My support from young voters -- those 18 to 24 -- in November 2014 was largely unheard of for a Republican.,0,1
"Even a 100 percent tax on millionaires would only fund four months of government operations, failing to seriously address budget deficits and debt.",0,1
Claims Supreme Court Justice Ruth Bader Ginsburg said she prefers the South African Constitution over the United States Constitution.,1,0
"""I will keep taxes low and cut them where I can. My opponent will raise them.""",0,1
Says we could have saved ourselves the cost of building the Powell Butte water reservoir.,1,0
Says he would have almost twice the actual experience practicing law Greg Abbott did on becoming attorney general of Texas.,0,1
Gubernatorial candidate Maggie Hassan supported 33 tax and fee increases as Senate Majority Leader.,0,1
Says challenger Dominic Chavez is a Rick Perry Republican lobbyist.,1,0
"Says Scott Walker cut taxes for the wealthiest and raised taxes on 140,000 Wisconsin families.",0,1
"If you work 40 hours a week at the proposed minimum wage of $10.10 an hour, you get out of poverty.",0,1
"In one Colorado hospital, 50 percent of newborns tested had marijuana in their system.",0,1
"Republicans included the Akin amendment in the Republican Party platform, which bans abortion, even for rape victims.",0,1
"Says that under City Council Member Randi Shade, Austin had the highest city debt per person in Texas.",1,0
One out of four corporations doesnt pay a nickel in (federal income) taxes.,0,1
I had five of my citizens that were killed last week because of border security problems.,0,1
Oregon and the federal government now have more than one million acres of burnt land and millions of trees are being left to rot.,0,1
The cheerleaders for the Dallas Cowboys have entertained more troops in the world than Bob Hope.,1,0
"Scary fact about our national debt. In 1791 it was $75 million. Today, it rises by that amount in about an hour.",0,1
The health care reform law reduces the deficit by nearly $1.2 trillion over the next two decades.,0,1
"Over 214,000 doctors opt out of Obamacare exchanges.",1,0
Says a $12.5 million incentive deal she approved for Abbott Laboratories contained strong protections for taxpayers if job creation goals were not met.,1,0
A legacy of taxing and borrowing crippled the economy we inherited two years ago.,1,0
"""Law enforcement in the state of Arizona supports"" the state's new immigration law.",0,1
Says Barack Obama has gone from blaming George W. Bush to plagiarizing George W. Bush.,1,0
Donald Trump says all Mexicans are rapists.,1,0
2008: Unions Spent $400 Million to Elect Obama.,1,0
"Says Mary Burkes 2007-09 state budget had a tax hike of $1.8 billion -- costing every man, woman and child in the state an extra $310.",1,0
The climate hasnt warmed in quite a few years. That is proven scientifically.,1,0
"In the fall of 2009, only 21 percent of Texas high school graduates enrolled in a four-year public university.",0,1
A North Carolina study proves that probably over a million people voted twice in (the 2012) election.,1,0
Tarpon Springs takes its homeless to St. Petersburg.,1,0
The United States sends $300 billion -- half our trade deficit -- overseas for oil to unstable and unfriendly regimes.,0,1
Our population has grown from about 1 million in the 1970s to almost 7 million today.,0,1
"Since President Obama took office, gas prices have gone up 67 percent.",0,1
"When President Franklin D. Roosevelt started Social Security, it only affected widows and orphans, and when Medicare began, it was a small program.",1,0
We paid down the debt for four years -- paid down $600 billion on the national debt.,0,1
A vast majority of the production in the United States comes from small independent oil and gas companies.,0,1
"An Army report stated Allen West performed illegal acts, merited court martial, faced 11 years in prison.",0,1
"In this city, there hasnt been a stadium thats lasted more than 27 years.",0,1
"More people are driving under the influence of drugs than are driving under the influence of alcohol. A recent roadside survey showed that 16 percent of the people tested, tested positive for illicit or licit drugs. Thats significantly higher than alcohol.",0,1
Says Hillary Clinton refuses to testify before Congress about the 2012 attack in Benghazi.,1,0
Commerce Secretary nominee John Bryson appears to endorse world government.,1,0
Says Rob Portman even voted to allow people on the terrorism watch list to buy guns.,1,0
Texas agriculture is at 98 percent efficiency in water use and just about maxed out as to what we can do on the conservation end of it.,0,1
Our president has labeled Americans as soft.,0,1
ISIS leader Abu Bakr al Baghdadi was released by Obama in 2009.,1,0
"""Going to public financing really disadvantages Democrats because you're not able to raise funds between the day you win the primaries and the time you're officially nominated.""",0,1
"In the history of Republican primaries, Ive gotten the most votes in the history of the Republican party.",1,0
"When the New Hampshire Legislature raised the gasoline tax, gas prices in the state were skyrocketing.",1,0
"We will spend $100 billion in Afghanistan this year, fixing roads, building bridges, training police officers, and more, [and] cutting the same things in our own country.",1,0
On whether BPs $20 billion fund to compensate oil spill victims is a slush fund.,1,0
On in-state tuition for illegal immigrants.,1,0
"""Medicare has at least $80 billion worth of fraud a year. That's a full 20 percent of every dollar that's spent on Medicare goes to fraud.""",0,1
"""What were the old annual deficits under Republicans have now become the monthly deficits under Democrats.""",1,0
There were more people at the Air and Space Museum than at a rally against the health care bills.,0,1
People for the Ethical Treatment of Animals estimates 200 animals will be spared annually as the result of former President Bill Clinton adopting a vegan diet.,0,1
We spend almost twice as much per capita on health care as do the people of any other country.,1,0
"Says Bruce Starr voted to throw 6,000 Oregonians off unemployment.",0,1
We need to pass a carbon tax to stop climate change. Break up the Wall Street banks. And stop the government spying on innocent Americans. Cory Booker doesnt support any of these ideas.,0,1
"Says more than 1 million Texans are jobless, the state has its highest unemployment rate in more than 20 years and joblessness doubled on Rick Perrys watch.",0,1
"Lots of studies seem to indicate that minors find it very easy to get marijuana, easier than to get alcohol.",1,0
"Russia has tremendous numbers of nuclear warheads 1,800, by the way where they expanded, and we didnt.",0,1
Says President Obamas decision to not issue a permit for the Keystone XL pipeline meant we were denied the ability immediately to reduce prices at the pump.,1,0
Seven out of the 10 states with the lowest unemployment rates (have) Republican governors That approach that Republicans are using is working.,0,1
The health care law reduces the number of uninsured in America by 3 percent for how much money? $2 trillion.,1,0
"""We import more oil today than ever before.""",1,0
"Today in Selma, Ala., the poverty rate is roughly nine times that of whites.",0,1
Says President Obama was proposing pinprick strikes for military intervention in Syria.,1,0
Says there are no political prisoners in Cuba.,1,0
Says last year the graduation rate for our combined six-district footprint jumped 5.5 percent.,0,1
Milwaukee police use deadly force at a rate that is among the lowest in the country.,0,1
"Says EPA regulation of greenhouse gases will endanger 575 Texas dairy facilities, 58 swine operations, 1,300 corn farms and 28,000 beef cattle operations.",1,0
California has added twice as many jobs as Florida over the past year.,0,1
"The Employment Non-Discrimination Act discriminates against Christian daycare, Christian parents, Christian business owners, and the rights of religious freedom.",1,0
Brookhaven homeowners pay hundreds of dollars less in property taxes compared with owners of the same-value homes in unincorporated DeKalb County.,0,1
Says health insurance premiums will rise under Obamacare.,0,1
Missouri is the state with the lowest paid workers.,0,1
On whether the state should ramp up borrowing to build roads.,0,1
Electricity rates are 40 percent higher in states that have required utility companies to use a certain amount of renewable energy such as solar power.,0,1
"In the 1980s, The lowest income people had the biggest gains.",1,0
Florida has issued more than 3 million conceal carry permits in the past 30 years. Only 168 have been revoked.,0,1
"For every one job created under the Obama administration, 75 people went on food stamps.",1,0
Says Chris Koster opposes right-to-work efforts because he has taken $8 million from union bosses.,0,1
Says Bush Jr. handed Obama a $1.4 trillion deficit and Obama reduced Bush Jr.s deficit to just $492 billion.,0,1
Says President Barack Obama made unilateral changes to Obamacare 38 times.,0,1
Obamacare could force thousands of volunteer fire stations to cut service or close entirely!,0,1
The administration has issued rules for $1 abortions in ObamaCare and requires all persons enrolled in insurance plans that include elective abortion coverage to pay an abortion premium.,1,0
Says Gov. Rick Perry has never held a private-sector job.,1,0
Says Indiana Gov. Mike Pence advocated diverting taxpayer dollars to so-called conversion therapy.,0,1
"Says Ted Cruz has pledged to eliminate the U.S. Department of Education, which would end federal aid to college students.",0,1
Illegal immigration costs state taxpayers over $3 billion every year.,1,0
"Says a liberal immigration reform group endorsed his GOP primary opponent, Dave Brat.",1,0
Welders make more money than philosophers.,1,0
The American people spoke pretty loudly. They said stop all the looming tax hikes....,1,0
"For the hour after the (Jan. 14) debate, Debra Medina was the No. 1 search on Google and for the remainder of that night No. 3.",1,0
"Says state budget deal between Texas House and Senate leaders funds nursing homes, our public schools and universities and provides financial aid for college students.",0,1
After four years of a celebrity president 85% (of recent college grads are) moving back in with their parents.,1,0
Says Rick Perry co-chaired Al Gores campaign for president.,0,1
I was totally against the war in Iraq.,1,0
Says Suzanne Bonamici supports the $500 billion cut to Medicare passed last year.,1,0
Says Democratic Senate candidate Bruce Braley voted to cut $700 billion from Medicare to support Obamacare.,0,1
Preventive care coverage under the Affordable Care Act has already helped Granite Staters save money and live healthier lives.,0,1
"1928 was last time Republicans had the White House, the House and the Senate.",1,0
Hillary Clinton and Barack Obama want to raise taxes on all income brackets.,1,0
U.S. Sen. Saxby Chambliss votes more with Democrats than with conservatives.,1,0
This is the first time since World War II that five nuclear-powered aircraft carriers were docked together.,1,0
Ive never voted for a Democrat when there was a Republican on the ballot.,0,1
"Says U.S. Senate rival Tommy Thompson wants to give a new $265,000 tax cut to millionaires like himself while raising taxes on the middle class.",0,1
Atlanta Mayor Kasim Reed held not one conversation with the public about the new Falcons stadium project,0,1
"In a budget deal struck in 2011 a trillion dollars of cuts went into effect immediately, and then a special committee was set up ... to get agreement on another $3 trillion of cuts.",0,1
"If you're a small business and don't ""adopt the health care plan that Senator Obama mandates, he's going to fine you.""",1,0
"""Whether in Illinois or Washington, Barack Obama has bridged partisanship to bring about significant reform.""",0,1
"New jobs numbers are in, and Wisconsin has fallen to dead last in Midwest job growth.",1,0
"""Under the Baucus bill ... federal funds would subsidize coverage of elective abortions.""",1,0
Cap-and-trade is wildly unpopular with Americans.,1,0
Teachers were not involved in developing the Common Core State Standards.,1,0
This (parent trigger) legislation was drafted by President Obamas top advisers. It was drafted by President Clintons top advisers.,1,0
"Shutdowns are a normal part of the constitutional process, with 12 shutdowns under Democratic House Speaker Tip ONeill and two during his own speakership.",0,1
"Since 2007, Texas has gained 440,000 people while Maryland has lost 20,000.",0,1
Said state insurance commissioner candidate Ralph Hudgens fights hard to strip women of life-saving coverage such as mammograms.,0,1
On a cap-and-trade plan.,1,0
The left is blatantly attempting to disrupt Georgias elections.,1,0
"Says Obamas net neutrality proposalputs the government in charge of determining Internet pricing, terms of service and what types of products and services can be delivered.",0,1
"""Earmarked dollars have doubled just since 2000, and more than tripled in the last 10 years.""",0,1
